{
  "schema_version": "0.1.0",
  "decision_id": "example-decision-01",
  "request_id": "example-request-01",
  "outcome": "allow",
  "reason_code": "resource-grant",
  "resource_id": "finance.reports",
  "action": "read",
  "subject_ref": "example-subject-01",
  "revisions": {
    "authority_epoch": "example-authority-01",
    "catalog": 1,
    "policy": 1,
    "identity": 1,
    "network": 1
  },
  "obligations": [
    {
      "kind": "application_object_authorization"
    },
    {
      "kind": "no_export"
    },
    {
      "kind": "no_sensitive_logging"
    }
  ],
  "valid_until": "2026-10-12T00:00:30Z"
}
